1,4037669694,4002872265,87242.41,1,COMPENSACION DIC 21,ANA BERTHA CASTILLEJOS MOLINA,0
2,4037669694,6114723829,70487.97,1,COMPENSACION DIC 21,CARMEN SOFIA GUZMAN GOMEZ,0
3,4037669694,4039157789,31927.8,1,COMPENSACION DIC 21,AURORA ADRIANA SANCHEZ BARREIRA,0
4,4037669694,4058328931,40403.55,1,COMPENSACION DIC 21,VERONICA LILLERMING VELARDE VARGAS,0
5,4037669694,6350462910,28409.72,1,COMPENSACION DIC 21,CLARA  PATIÑO QUINTERO,0
6,4037669694,6428619344,47340.55,1,COMPENSACION DIC 21,SCARLETT DEL CARMEN RODRIGUEZ ANDRADE,0
7,4037669694,4061565602,33380.92,1,COMPENSACION DIC 21,MARTHA EUGENIA MORALES GONZALEZ,0
8,4037669694,6490499096,20550.68,1,COMPENSACION DIC 21,PATRICIA SALAZAR URTAZA,0
1,8,COMPENSACION DIC 21
